{
  "$schema": "https://json-schema.org/draft/2020-12/schema",
  "title": "India Demand Federation Publish Event",
  "type": "object",
  "required": ["source", "external_event_id", "text", "district"],
  "properties": {
    "source": {"type": "string", "minLength": 2},
    "external_event_id": {"type": "string", "minLength": 2},
    "channel": {"type": "string", "default": "Federation"},
    "language": {"type": "string", "default": "en"},
    "district": {"type": "string"},
    "state": {"type": "string"},
    "text": {"type": "string", "minLength": 3},
    "sender": {"type": "string"},
    "ward": {"type": "string"},
    "occurred_at": {"type": "string", "format": "date-time"},
    "meta": {"type": "object"}
  },
  "additionalProperties": true
}